{
  "id": "agent-12345678",
  "device_id": "dev-12345678",
  "version": "0.1.0",
  "control_plane_url": "http://localhost:8080",
  "heartbeat_interval_sec": 15,
  "permissions": {
    "read_only": true,
    "allowed_paths": ["/var/log", "/etc"]
  },
  "resources": {
    "cpu_limit": 2,
    "memory_limit_mb": 1024
  },
  "tags": ["role:server", "os:linux"]
}
